entity,entity_long,entity_combined,entity_aliases,entity_description,entity_footnotes,entity_link,entity_wikipedia_page,entity_news_page,entity_branding_page,entity_data_page,entity_logo_page,entity_logo_url,entity_logo_available,entity_careers_page,entity_headquarters,un_principal_organ,category,subcategory,is_ceb_member,foundational_mandate,entity_mandate_registry,entity_custom_mandate_registry,organizational_chart_link,budget_financial_reporting_link,results_framework_link,strategic_plan_link,annual_reports_link,transparency_portal_link,socials_linkedin,socials_twitter,socials_instagram
OSC-SEA,Office of the Special Coordinator on Improving the UN Response to Sexual Exploitation and Abuse,Office of the Special Coordinator on Improving the UN Response to Sexual Exploitation and Abuse (OSC-SEA),,"On 15 July 2022, United Nations Secretary-General António Guterres announced the appointment of Christian Saunders as Special Coordinator on improving the United Nations response to sexual exploitation and abuse. Mr. Saunders brings to the position over thirty years of experience in international affairs, much of it focusing on delivering results and overseeing major reforms",,https://www.un.org/preventing-sexual-exploitation-and-abuse/content/un-special-coordinator-0,Not found,Not found,,,,,,,,Secretariat,"Special Advisers, Representatives, Advocates and Envoys",,False,,,,,,No link found,No link found,https://www.un.org/preventing-sexual-exploitation-and-abuse/content/secretary-generals-reports,Not found,Not found.,,
OSESG-SYRIA,Office of the Special Envoy of the Secretary-General for Syria,Office of the Special Envoy of the Secretary-General for Syria (OSESG-SYRIA),,,,https://specialenvoysyria.unmissions.org/,https://en.wikipedia.org/wiki/Office_of_the_Special_Envoy_for_Syria,Not found,,,,,,,,Security Council,Special Political Missions and Other Political Presences,,False,,,,,,No link found,No link found,https://specialenvoysyria.unmissions.org/security-council-briefings-text,Not found,Not found.,,
OSESGY,Office of the Special Envoy of the Secretary-General for Yemen,Office of the Special Envoy of the Secretary-General for Yemen (OSESGY),,,,https://osesgy.unmissions.org/,https://en.wikipedia.org/wiki/Office_of_the_Special_Envoy_of_the_Secretary-General_for_Yemen,https://osesgy.unmissions.org/news,,,,,,,,Security Council,Special Political Missions and Other Political Presences,,False,,,,,,No link found,No link found,https://osesgy.unmissions.org/briefings-security-council,Not found,Not found.,,
OVRA,Office of the Victims' Rights Advocate,Office of the Victims' Rights Advocate (OVRA),,,,https://www.un.org/preventing-sexual-exploitation-and-abuse/content/victims-rights-advocate,Not found.,Not found,,,,,,,,Secretariat,"Special Advisers, Representatives, Advocates and Envoys",,False,,,,https://www.un.org/preventing-sexual-exploitation-and-abuse/sites/www.un.org.preventing-sexual-exploitation-and-abuse/files/ovra_fact_sheet_2021.pdf,,No link found,No link found,https://www.un.org/preventing-sexual-exploitation-and-abuse/content/annual-reports-victims-rights-advocate,Not found,Not found.,https://x.com/UN_OVRA,
PBSO,Peacebuilding Support Office,Peacebuilding Support Office (PBSO),,"As part of the Department of Political and Peacebuilding Affairs (DPPA), the Peacebuilding Support Office (PBSO) serves as a facilitator to enhance coherence and collaboration across the UN system and with partners in support of nationally owned efforts to build and sustain peace. Established in 2005, PBSO draws together expertise to advance impactful system-wide action, policies and guidance and fosters an integrated and inclusive approach to prevention and sustaining peace.

The Office comprises the Peacebuilding Commission Support Branch, the Financing for Peacebuilding Branch and the Peacebuilding Strategy and Partnerships Branch. Led by Assistant Secretary-General, Elizabeth Spehar, PBSO assists and supports the Peacebuilding Commission (PBC) with strategic advice and policy guidance, manages the Peacebuilding Fund (PBF) on behalf of the Secretary-General, and works to enhance system-wide coherence and partnerships with UN and non-UN actors in support of building and sustaining peace in partner countries.",,https://www.un.org/peacebuilding/,,,,,,,,,,Secretariat,,,False,,,,,,,,,,,,
PoE-RES2745,Panel of Experts pursuant to resolution 2745 (2024),Panel of Experts pursuant to resolution 2745 (2024) (PoE-RES2745),,,,https://main.un.org/securitycouncil/en/sanctions/2745/panel-of-experts/work_mandate,,,,,,,,,,,,,,,,,,,,,,,,,
SASG-PGRP,Office of the Special Advisers to the Secretary-General on the Prevention of Genocide and the Responsibility to Protect,Office of the Special Advisers to the Secretary-General on the Prevention of Genocide and the Responsibility to Protect (SASG-PGRP),,,,https://www.un.org/en/genocide-prevention/,,,,,,,,,,Secretariat,"Special Advisers, Representatives, Advocates and Envoys",,False,,,,,,,,,,,https://x.com/UNOSAPG,
SASG-SID,Office of the Special Adviser to the Secretary-General on Solutions to Internal Displacement,Office of the Special Adviser to the Secretary-General on Solutions to Internal Displacement (SASG-SID),,,,https://www.un.org/en/solutions-to-internal-displacement,,,,,,,,,,Secretariat,"Special Advisers, Representatives, Advocates and Envoys",,,,,,,,,,,,,,
SESG-GL,Office of the Special Envoy of the Secretary-General for the Great Lakes Region,Office of the Special Envoy of the Secretary-General for the Great Lakes Region (SESG-GL),,"The Special Envoy leads, coordinates and assesses implementation of the PSC Framework, to address the root causes of conflict and end recurring violence in eastern DRC and the Great Lakes.",,https://ungreatlakes.unmissions.org/,https://en.wikipedia.org/wiki/United_Nations_Special_Envoy_for_the_Great_Lakes_Region,https://ungreatlakes.unmissions.org/en/news,,,,,,,,Security Council,Special Political Missions and Other Political Presences,,False,"https://ungreatlakes.unmissions.org/en/ungreatlakes/un-great-lakes-mandate
",,,,,No link found,No link found,https://ungreatlakes.unmissions.org/secretary-generals-reports,Not found,Not found.,,
SRSG-CAAC,Office of the Special Representative of the Secretary-General for Children and Armed Conflict,Office of the Special Representative of the Secretary-General for Children and Armed Conflict (SRSG-CAAC),,,,https://childrenandarmedconflict.un.org/,https://en.wikipedia.org/wiki/Office_of_the_Special_Representative_of_the_Secretary-General_for_Children_and_Armed_Conflict,https://childrenandarmedconflict.un.org/news/,,,,,,,,Secretariat,"Special Advisers, Representatives, Advocates and Envoys",,False,,,,,,No link found,No link found,https://childrenandarmedconflict.un.org/virtual-library/?wpv-document-type%5B%5D=annual-reports&wpv_aux_current_post_id=2680&wpv_aux_parent_post_id=2680&wpv_view_count=110467,Not found,Not found.,,
SRSG-SVC,Office of the Special Representative of the Secretary-General on Sexual Violence in Conflict,Office of the Special Representative of the Secretary-General on Sexual Violence in Conflict (SRSG-SVC),,,,https://www.un.org/sexualviolenceinconflict/,https://en.wikipedia.org/wiki/Office_of_the_Special_Representative_of_the_Secretary-General_on_Sexual_Violence_in_Conflict,https://www.un.org/sexualviolenceinconflict/news/,,,,,,,,Secretariat,"Special Advisers, Representatives, Advocates and Envoys",,False,,,,,,No link found,No link found,https://www.un.org/sexualviolenceinconflict/digital-library/reports/,Not found,Not found.,,
SRSG-VAC,Office of the Special Representative of the Secretary-General on Violence against Children,Office of the Special Representative of the Secretary-General on Violence against Children (SRSG-VAC),,,,https://violenceagainstchildren.un.org/,https://en.wikipedia.org/wiki/Office_of_the_Special_Representative_of_the_Secretary-General_on_Violence_against_Children,https://violenceagainstchildren.un.org/news,,,,,,,,Secretariat,"Special Advisers, Representatives, Advocates and Envoys",,False,,,,,,No link found,No link found,https://violenceagainstchildren.un.org/en/publications?search_api_fulltext=,Not found,Not found.,,
SWEO,United Nations Sustainable Development Group System-Wide Evaluation Office,United Nations Sustainable Development Group System-Wide Evaluation Office (SWEO),,,,https://www.un.org/system-wide-evaluation-office/,Not found,Not found,,,,,,,,Secretariat,,,False,,,,,,No link found,No link found,https://www.un.org/system-wide-evaluation-office/en/document-library,Not found,Not found.,,
Second Committee,Economic and Financial Committee,Economic and Financial Committee (Second Committee),,,,https://www.un.org/en/ga/second/index.shtml,,,,,,,,,,General Assembly,Intergovernmental and Expert Bodies,Main Committees,,,,,,,,,,,,,
Sixth Committee,Legal,Legal (Sixth Committee),,,,https://www.un.org/en/ga/sixth/index.shtml,,,,,,,,,,General Assembly,Intergovernmental and Expert Bodies,Main Committees,,,,,,,,,,,,,
StatCom,United Nations Statistical Commission,United Nations Statistical Commission (StatCom),,,,https://unstats.un.org/UNSDWebsite/statcom/,,,,,,,,,,Economic and Social Council,Functional Commissions,,,,,,,,,,,,,,
TDB,Trade and Development Board,Trade and Development Board (TDB),,,,https://unctad.org/about/trade-and-development-board,,,,,,,,,,General Assembly,Intergovernmental and Expert Bodies,Boards,,,,,,,,,,,,,
Third Committee,"Social, Humanitarian & Cultural Issues","Social, Humanitarian & Cultural Issues (Third Committee)",,,,https://www.un.org/en/ga/third/index.shtml,,,,,,,,,,General Assembly,Intergovernmental and Expert Bodies,Main Committees,,,,,,,,,,,,,
UN Tourism,World Tourism Organization,World Tourism Organization (UN Tourism),,,"- Member of the United Nations System Chief Executives Board for Coordination (CEB).
- This organization is separate and independent from the United Nations. It has been brought into relationship with the United Nations through a relationship agreement.
",https://www.untourism.int/,https://en.wikipedia.org/wiki/United_Nations_World_Tourism_Organization,https://www.unwto.org/news,,,,,,,"Madrid, Spain",Specialized Agencies,,,True,,,,,No link found,No link found,No link found,https://www.e-unwto.org/,Not found,https://www.linkedin.com/company/unwto/,https://x.com/UNWTO,
UN Youth,United Nations Youth Office,United Nations Youth Office (UN Youth),,,,https://www.un.org/youthaffairs/,https://en.wikipedia.org/wiki/United_Nations_Youth_Office,https://www.un.org/youthaffairs/news,,,,,,,,Secretariat,"Special Advisers, Representatives, Advocates and Envoys",,False,,,,,,No link found,No link found,https://www.un.org/youthaffairs/en/youth2030/progress-report,Not found,https://www.linkedin.com/company/un-youth-affairs,,
UN-Habitat,United Nations Human Settlements Programme,United Nations Human Settlements Programme (UN-Habitat),,"UN-Habitat works for a better urban future. Based in over 90 countries, we promote the development of socially and environmentally sustainable cities, towns & communities. UN-Habitat strives for adequate shelter with better living standards for all.","- Member of the United Nations System Chief Executives Board for Coordination (CEB).
- The secretariat of this entity is part of the United Nations Secretariat.
",https://unhabitat.org/,https://en.wikipedia.org/wiki/United_Nations_Human_Settlements_Programme,https://unhabitat.org/news,,,,,,,"Nairobi, Kenya",General Assembly,Funds and Programmes,,True,,,,,,https://unhabitat.org/sites/default/files/2025/02/briefing_on_monitoring_of_strategic_plan_2026-2029.pdf,https://unhabitat.org/about-us/our-strategy,https://unhabitat.org/knowledge/research-and-publications,Not found,https://www.linkedin.com/company/un-habitat/,https://x.com/UNHABITAT,
UN-Habitat Assembly,United Nations Habitat Assembly of the United Nations Human Settlements Programme,United Nations Habitat Assembly of the United Nations Human Settlements Programme (UN-Habitat Assembly),,"On 20 December 2018, the General Assembly of the United Nations in its resolution A/RES/73/239 decided to dissolve the Governing Council of the United Nations Human Settlements Programme and to replace it with a United Nations Habitat Assembly of the United Nations Human Settlements Programme (UN-Habitat Assembly). UN-Habitat Assembly is a universal body composed of the 193 member states of the United Nations and convenes every four years (A/RES/73/239).","- Current governing body of UN-Habitat (since 2019)
- Formerly: ""Governing Council of the United Nations Human Settlements Programme"" (1978–2019)
",https://unhabitat.org/governance/un-habitat-assembly,,,,,,,,,,General Assembly,Intergovernmental and Expert Bodies,Assemblies and Councils,,,,,,,,,,,,,
UN-OHRLLS,"Office of the High Representative for the Least Developed Countries, Landlocked Developing Countries and Small Island Developing States","Office of the High Representative for the Least Developed Countries, Landlocked Developing Countries and Small Island Developing States (UN-OHRLLS)",,,,https://www.un.org/ohrlls/,"https://en.wikipedia.org/wiki/United_Nations_Office_of_the_High_Representative_for_the_Least_Developed_Countries,_Landlocked_Developing_Countries_and_Small_Island_Developing_States",https://www.un.org/ohrlls/news,,,,,,,,Secretariat,"Special Advisers, Representatives, Advocates and Envoys",,False,,,,,,https://open.unwomen.org/en/global-results/overview,https://www.un.org/ohrlls/sites/www.un.org.ohrlls/files/dpoa_roadmap_2024_draft.pdf,https://www.un.org/ohrlls/content/resources,Not found,https://www.linkedin.com/company/un-ohrlls/,https://x.com/UNOHRLLS,
UN-Women,United Nations Entity for Gender Equality and the Empowerment of Women,United Nations Entity for Gender Equality and the Empowerment of Women (UN-Women),,"UN Women is the global champion for gender equality, working to develop and uphold standards and create an environment in which every woman and girl can exercise her human rights and live up to her full potential. We are trusted partners for advocates and decision-makers from all walks of life, and a leader in the effort to achieve gender equality.","- Member of the United Nations System Chief Executives Board for Coordination (CEB).

",https://www.unwomen.org/,https://en.wikipedia.org/wiki/UN_Women,https://www.unwomen.org/en/news,,https://data.unwomen.org/,,,,,"New York City, USA",General Assembly,Other Entities,,True,,,,https://www.unwomen.org/sites/default/files/2025-08/unw_org_chart_internal_20250806.pdf,https://www.unwomen.org/en/executive-board/strategic-plan-review/financial-resources,https://www.unwomen.org/sites/default/files/2025-10/un-women-strategic-plan-2026-2029-integrated-results-and-resources-framework-en.pdf,https://www.unwomen.org/sites/default/files/2022-05/UN%20Women%20SP%20IRRF%202022-2025.pdf,https://www.unwomen.org/en/digital-library/annual-report,https://data.unwomen.org/data-portal,https://www.linkedin.com/company/un-women/,https://x.com/UN_Women,
UNAIDS,Joint United Nations Programme on HIV/AIDS,Joint United Nations Programme on HIV/AIDS (UNAIDS),,"UNAIDS brings together the efforts and resources of 10 UN system organizations to help prevent new HIV infections, care for people living with HIV and mitigate the impact of the epidemic.",,https://www.unaids.org/en,https://en.wikipedia.org/wiki/Joint_United_Nations_Programme_on_HIV/AIDS,https://www.unaids.org/en/news,,,,,,,"Geneva, Switzerland",Economic and Social Council,Other Bodies,,False,,,,,https://www.unaids.org/en/topic/resources,No link found,https://www.unaids.org/sites/default/files/media_asset/global-AIDS-strategy-2021-2026_en.pdf,https://www.unaids.org/en/topics/resources/publications,https://open.unaids.org/,https://www.linkedin.com/company/unaids/,,
UNAMA,United Nations Assistance Mission in Afghanistan,United Nations Assistance Mission in Afghanistan (UNAMA),,"UNAMA’s mission is to support the people and institutions of Afghanistan in achieving peace and stability, in line with the rights and obligations enshrined in the Afghan constitution.",,https://unama.unmissions.org/,https://en.wikipedia.org/wiki/United_Nations_Assistance_Mission_in_Afghanistan,https://unama.unmissions.org/news,,,,,,,,Security Council,Special Political Missions and Other Political Presences,,False,,,,,,No link found,https://unama.unmissions.org/sites/default/files/unsf_afghanistan_formatted_20230629.pdf,https://unama.unmissions.org/secretary-general-reports,Not found,Not found.,,
UNAOC,United Nations Alliance of Civilizations,United Nations Alliance of Civilizations (UNAOC),,"UNAOC aims to bridge divides, and promote harmony among the nations, all with a view toward preventing conflict and promoting social cohesion.",,https://www.unaoc.org/,https://en.wikipedia.org/wiki/United_Nations_Alliance_of_Civilizations,https://www.unaoc.org/category/news/,,,,,,,,Secretariat,,,False,,,,,,No link found,https://www.unaoc.org/wp-content/uploads/UNAOC-Action-Plan-POA-2024-2026-250203_web.pdf,https://www.unaoc.org/resource-type/unaoc-annual-reports/,Not found,https://www.linkedin.com/company/united-nations-alliance-of-civilizations/,,
UNCCD,United Nations Convention to Combat Desertification,United Nations Convention to Combat Desertification (UNCCD),,,,https://www.unccd.int/,,,,,,,,,,Secretariat,,,,,,,,,,https://www.unccd.int/convention/governance/strategic-framework-2018-2030,,,,,
UNCDF,United Nations Capital Development Fund,United Nations Capital Development Fund (UNCDF),,"The United Nations Capital Development Fund's mission is to contribute to job creation, sustained economic growth and equitable prosperity in almost 80 developing countries and nearly all LDCs.

We do so by crowding in capital through the deployment of risk-absorbing financial instruments, mechanisms and structuring advisory. In partnership with UN entities and development partners, UNCDF operates with speed and agility to deliver scalable, blended finance solutions to drive systemic change and pave the way for commercial finance and scale up by development finance institutions and multilateral development banks.",,https://www.uncdf.org/,,,,,,,,,,General Assembly,Funds and Programmes,,False,,,,,,,https://www.uncdf.org/article/3208/making-finance-work-for-inclusion-uncdf-presents-new-four-year-strategic-framework-to-its-board,,,,,
UNCITRAL,United Nations Commission on International Trade Law,United Nations Commission on International Trade Law (UNCITRAL),,,,https://uncitral.un.org/,,,,,,,,,,General Assembly,Intergovernmental and Expert Bodies,Commissions,,,,,,,,,,,,,
UNCTAD,United Nations Conference on Trade and Development,United Nations Conference on Trade and Development (UNCTAD),,UNCTAD supports developing countries to access the benefits of a globalized economy more fairly and effectively and helps equip them to deal with the potential drawbacks of greater economic integration.,"- Member of the United Nations System Chief Executives Board for Coordination (CEB).
- The secretariat of this entity is part of the United Nations Secretariat.
",https://unctad.org/,https://en.wikipedia.org/wiki/United_Nations_Conference_on_Trade_and_Development,https://unctad.org/news,,,,,,,,General Assembly,Other Entities,,True,,,,,,No link found,https://unctad.org/dmfas/our_Strategic_Plan,https://unctad.org/publications-search?Operator=and&keys=annual,Not found,https://www.linkedin.com/company/unctad/,,
UNDC,Disarmament Commission,Disarmament Commission (UNDC),,,,https://disarmament.unoda.org/en/united-nations-disarmament-commission,,,,,,,,,,General Assembly,Intergovernmental and Expert Bodies,Commissions,,,,,,,,,,,,,
UNDEF,United Nations Democracy Fund,United Nations Democracy Fund (UNDEF),,,,https://www.un.org/democracyfund/,,,,,,,,,,Secretariat,,,,,,,,,,,,,,,
UNDOF,United Nations Disengagement Observer Force,United Nations Disengagement Observer Force (UNDOF),,"The UNDOF assists in maintaining the ceasefire between Israel and Syria, supervising the disengagement of Israeli and Syrian forces; as well as the areas of separation and limitation, as provided in the May 1974 Agreement on Disengagement.",,https://undof.unmissions.org/,https://en.wikipedia.org/wiki/United_Nations_Disengagement_Observer_Force,https://undof.unmissions.org/news,,,,,,,,Security Council,Peacekeeping Operations,,False,,,,,,No link found,No link found,https://undof.unmissions.org/reports-statements,Not found,Not found.,,
UNDP,United Nations Development Programme,United Nations Development Programme (UNDP),,"The UNDP helps build inclusive, sustainable and resilient societies and provides expert advice, training and financial support. Special attention is paid to the needs of the Least Developed Countries and countries emerging from conflict.","- Member of the United Nations System Chief Executives Board for Coordination (CEB)
",https://www.undp.org/,https://en.wikipedia.org/wiki/United_Nations_Development_Programme,https://www.undp.org/news,,,,,True,https://jobs.undp.org/,"New York City, USA",General Assembly,Funds and Programmes,,True,,,,https://www.undp.org/organizational-chart,,https://rolhr.undp.org/annualreport/2023/results-framework.html,https://strategicplan.undp.org/,https://annualreport.undp.org/,https://open.undp.org/,https://www.linkedin.com/company/united-nations-development-programme/,https://x.com/UNDP,https://www.instagram.com/undp/
UNDRR,United Nations Office for Disaster Risk Reduction,United Nations Office for Disaster Risk Reduction (UNDRR),,"UNDRR brings governments, partners, and communities together to reduce disaster risk and losses and to ensure a safer, sustainable future.",,https://www.undrr.org/,https://en.wikipedia.org/wiki/United_Nations_Office_for_Disaster_Risk_Reduction,https://www.undrr.org/news,,,,,,,,Secretariat,,,False,,,,,,No link found,https://www.undrr.org/media/49267/download,https://www.undrr.org/publications?text=Annual%20Report,Not found,https://www.linkedin.com/company/united-nations-office-for-disaster-risk-reduction-undrr/,https://x.com/UNDRR,
UNEA,United Nations Environment Assembly,United Nations Environment Assembly (UNEA),,,"- Also referred to as ""United Nations Environment Assembly of the United Nations Environment Programme (UNEP)""
",https://www.unep.org/environmentassembly/,,,,,,,,,,General Assembly,Intergovernmental and Expert Bodies,Assemblies and Councils,,,,,,,,,,,,,
UNEP,United Nations Environment Programme,United Nations Environment Programme (UNEP),,"The global authority for the environment with programmes focusing on climate, nature, pollution, sustainable development and more.","- Member of the United Nations System Chief Executives Board for Coordination (CEB)
- The secretariat of this entity is part of the United Nations Secretariat.
",https://www.unep.org/,https://en.wikipedia.org/wiki/United_Nations_Environment_Programme,https://www.unep.org/news,,,,,,,"Nairobi, Kenya",General Assembly,Funds and Programmes,,True,,,,,https://www.unep.org/resources/programme-work-and-budget,No link found,https://wedocs.unep.org/bitstream/handle/20.500.11822/42683/medium_term_strategy_2022.pdf?sequence=1&isAllowed=y,https://www.unep.org/annualreport/2021/index.php,https://open.unep.org/,https://www.linkedin.com/company/un-environment-programme/,https://x.com/UNEP,
UNESCO,"United Nations Educational, Scientific and Cultural Organization","United Nations Educational, Scientific and Cultural Organization (UNESCO)",,"UNESCO contributes to peace and security by promoting collaboration among nations through education, science and culture.","- Member of the United Nations System Chief Executives Board for Coordination (CEB).
- This organization is separate and independent from the United Nations. It has been brought into relationship with the United Nations through a relationship agreement.
",https://www.unesco.org/,https://en.wikipedia.org/wiki/UNESCO,https://www.unesco.org/en/news,,,,,,,"Paris, France",Specialized Agencies,,,True,,,,https://unesdoc.unesco.org/archives/organization-charts,https://www.unesco.org/en/budget-strategy,No link found,https://unesdoc.unesco.org/ark:/48223/pf0000378083_eng,https://www.unesco.org/en/budget-strategy,https://core.unesco.org/,https://www.linkedin.com/company/unesco/,https://x.com/UNESCO,
UNFF,United Nations Forum on Forests,United Nations Forum on Forests (UNFF),,,,https://www.un.org/esa/forests/,,,,,,,,,,Economic and Social Council,Functional Commissions,,,,,,,,,,,,,,
UNFICYP,United Nations Peacekeeping Force in Cyprus,United Nations Peacekeeping Force in Cyprus (UNFICYP),,"UNFICYP has remained on the island to supervise ceasefire lines, maintain a buffer zone, undertake humanitarian activities and support the good offices mission of the Secretary-General.",,https://unficyp.unmissions.org/,https://en.wikipedia.org/wiki/United_Nations_Peacekeeping_Force_in_Cyprus,https://unficyp.unmissions.org/news,,,,,,,,Security Council,Peacekeeping Operations,,False,,,,,,No link found,No link found,https://www.securitycouncilreport.org/un-documents/cyprus/,Not found,Not found.,https://x.com/UN_CYPRUS,
