entity,entity_long,entity_combined,entity_aliases,entity_description,entity_footnotes,entity_link,entity_wikipedia_page,entity_news_page,entity_branding_page,entity_data_page,entity_logo_page,entity_logo_url,entity_logo_available,entity_careers_page,entity_headquarters,un_principal_organ,category,subcategory,is_ceb_member,foundational_mandate,entity_mandate_registry,entity_custom_mandate_registry,organizational_chart_link,budget_financial_reporting_link,results_framework_link,strategic_plan_link,annual_reports_link,transparency_portal_link,socials_linkedin,socials_twitter,socials_instagram
ABDM,Advisory Board on Disarmament Matters,Advisory Board on Disarmament Matters (ABDM),,,,https://disarmament.unoda.org/en/our-work/disarmament-bodies/advisory-board-disarmament-matters,,,,,,,,,,General Assembly,Intergovernmental and Expert Bodies,Boards,,,,,,,,,,,,,
BINUH,United Nations Integrated Office in Haiti,United Nations Integrated Office in Haiti (BINUH),,BINUH focusses on the provision of advisory services and good offices in Haiti and aims to help create the conditions needed for sustainable development in.,,https://binuh.unmissions.org/,https://en.wikipedia.org/wiki/United_Nations_Integrated_Office_in_Haiti,https://binuh.unmissions.org/en/news,,,,,True,,,Security Council,Special Political Missions and Other Political Presences,,False,"<https://binuh.unmissions.org/en/binuh-mandate>

**The United Nations Integrated Office in Haiti (BINUH) is a special political mission established by the [Security Council in its resolution 2476](https://undocs.org/en/S/RES/2476(2019)) of 25 June 2019 and deployed under chapter VI of the United Nations Charter.**
",,,,,No link found,No link found,https://binuh.unmissions.org/fr/rapports,Not found,Not found.,,
Board of Auditors,Board of Auditors,Board of Auditors (Board of Auditors),,,,https://www.un.org/en/auditors/board/,,,,,,,,,,General Assembly,Intergovernmental and Expert Bodies,Boards,,,,,,,,,,,,,
CCPCJ,United Nations Commission on Crime Prevention and Criminal Justice,United Nations Commission on Crime Prevention and Criminal Justice (CCPCJ),,,,https://www.unodc.org/unodc/commissions/CCPCJ/index.html,,,,,,,,,,Economic and Social Council,Functional Commissions,,,,,,,,,,,,,,
CDP,Committee for Development Policy,Committee for Development Policy (CDP),,,,https://policy.desa.un.org/our-work/committee-for-development-policy,,,,,,,,,,Economic and Social Council,Other Bodies,,,,,,,,,,,,,,
CEB,Secretariat of the UN System Chief Executives Board for Coordination,Secretariat of the UN System Chief Executives Board for Coordination (CEB),,"The Chief Executives Board (CEB), composed of the Secretary-General and the executive heads of the organizations of the United Nations system, is responsible for promoting coherence, cooperation and coordination in the policies, programmes and activities of the organizations of the United Nations system in accordance with their mandates and in response to the decisions of intergovernmental bodies.",,https://unsceb.org/,https://en.wikipedia.org/wiki/United_Nations_System_Chief_Executives_Board_for_Coordination,https://unsceb.org/reports,,,,,,,,Secretariat,,,False,,,,,No link found,No link found,No link found,https://unsceb.org/reports?field_mechanism[94]=94&field_report[12]=12,https://open.un.org/un-secretariat-financials/expenses,Not found.,,
CEPA,Committee of Experts on Public Administration,Committee of Experts on Public Administration (CEPA),,,,https://publicadministration.desa.un.org/intergovernmental-support/cepa,,,,,,,,,,Economic and Social Council,Other Bodies,,,,,,,,,,,,,,
CND,United Nations Commission on Narcotic Drugs,United Nations Commission on Narcotic Drugs (CND),,,,https://www.unodc.org/unodc/commissions/CND/,,,,,,,,,,Economic and Social Council,Functional Commissions,,,,,,,,,,,,,,
CPD,United Nations Commission on Population and Development,United Nations Commission on Population and Development (CPD),,,,https://www.un.org/development/desa/pd/content/CPD,,,,,,,,,,Economic and Social Council,Functional Commissions,,,,,,,,,,,,,,
CSTD,United Nations Commission on Science and Technology for Development,United Nations Commission on Science and Technology for Development (CSTD),,,,https://unctad.org/topic/commission-on-science-and-technology-for-development,,,,,,,,,,Economic and Social Council,Functional Commissions,,,,,,,,,,,,,,
CSW,United Nations Commission on the Status of Women,United Nations Commission on the Status of Women (CSW),,,,https://www.unwomen.org/en/how-we-work/commission-on-the-status-of-women,,,,,,,,,,Economic and Social Council,Functional Commissions,,,,,,,,,,,,,,
CSocD,United Nations Commission for Social Development,United Nations Commission for Social Development (CSocD),,,,https://social.desa.un.org/csocd,,,,,,,,,,Economic and Social Council,Functional Commissions,,,,,,,,,,,,,,
CTBTO,Preparatory Commission for the Comprehensive Nuclear-Test-Ban Treaty Organization,Preparatory Commission for the Comprehensive Nuclear-Test-Ban Treaty Organization (CTBTO),,The CTBTO Preparatory Commission is mandated to carry out the necessary preparations for the entry into force and effective implementation of the Comprehensive Nuclear-Test-Ban Treaty (CTBT).,"- This organization is separate and independent from the United Nations. It has been brought into relationship with the United Nations through a relationship agreement.
",https://www.ctbto.org/,https://en.wikipedia.org/wiki/Comprehensive_Nuclear-Test-Ban_Treaty_Organization_Preparatory_Commission,https://www.ctbto.org/press-centre/news,,,,,True,,"Vienna, Austria",Related Organizations,,,False,,,,,,No link found,No link found,https://www.ctbto.org/publications/annual-reports/,Not found,https://www.linkedin.com/company/ctbto/,,
CTC,Counter-Terrorism Committee,Counter-Terrorism Committee (CTC),,,,https://www.un.org/securitycouncil/ctc/,,,,,,,,,,Security Council,Committees,,,,,,,,,,,,,,
DA,Development Account,Development Account (DA),,,,https://da.desa.un.org/,https://en.wikipedia.org/wiki/United_Nations_Development_Account,Not found,,,,,,,,Secretariat,,,False,,,,,No link found,No link found,No link found,https://da.desa.un.org/static-official-public,https://da.desa.un.org/project-view-public,Not found.,,
DCO,Development Coordination Office ,Development Coordination Office  (DCO),RCS,The Resident Coordinator System (RCS) is the backbone around which the United Nations development entities are taking steps to strengthen support to the 2030 Agenda.,,https://un-dco.org/,https://en.wikipedia.org/wiki/United_Nations_Development_Coordination_Office,https://un-dco.org/news,,,,,,,,Secretariat,,,False,,https://mandates.un.org/entity/RCS,,https://un-dco.org/,,No link found,No link found,https://unsdg.un.org/resources/unsdg-chair-reports,https://unsdg.un.org/SPTF,Not found.,,
DESA,Department of Economic and Social Affairs,Department of Economic and Social Affairs (DESA),,"UN DESA helps countries translate their global commitments into national action in the economic, social and environmental spheres.",,https://www.un.org/development/desa,https://en.wikipedia.org/wiki/United_Nations_Department_of_Economic_and_Social_Affairs,https://www.un.org/development/desa/en/news.html,,,,,,,,Secretariat,,,False,,,,https://www.un.org/development/desa/en/about/organigramme,No link found,No link found,No link found,https://desapublications.un.org/?keywords=un+desa+annual+highlights&sort_by=date&sort_order=DESC,https://open.un.org/un-secretariat-financials/expenses,https://www.linkedin.com/company/united-nations-department-of-economic-and-social-affairs,https://x.com/UNDESA,
DGACM,Department for General Assembly and Conference Management,Department for General Assembly and Conference Management (DGACM),,"The DGACM enhances dialogue and cooperation among Member States and, by doing so, to contributes to the realization of the objectives of the United Nations and of the Millennium Development Goals.",,https://www.un.org/dgacm/,https://en.wikipedia.org/wiki/Department_for_General_Assembly_and_Conference_Management,Not found,,,,,True,,,Secretariat,,,False,,,,https://www.un.org/dgacm/en/content/structure,No link found,No link found,No link found,No annual report,https://open.un.org/un-secretariat-financials/expenses,Not found.,https://x.com/UNDGACM_EN,
DGC,Department of Global Communications,Department of Global Communications (DGC),,"The DGC is dedicated to communicating the ideals and work of the United Nations to the world across multiple platforms, helping build support for peace, sustainable development and human rights for all.",,https://www.un.org/en/sections/departments/department-global-communications/,https://en.wikipedia.org/wiki/United_Nations_Department_of_Global_Communications,Not found,,,,,,,,Secretariat,,,False,,,,,https://digitallibrary.un.org/record/4010720?ln=&v=pdf,No link found,No link found,No annual report,https://open.un.org/un-secretariat-financials/expenses,Not found.,,
DMSPC,"Department of Management Strategy, Policy and Compliance","Department of Management Strategy, Policy and Compliance (DMSPC)",,"The DMSPC serves the United Nations globally to drive organizational excellence through innovation, accountability and solutions.",,https://www.un.org/management/,"https://en.wikipedia.org/wiki/Department_of_Management_Strategy,_Policy_and_Compliance",Not found,,,,,,,,Secretariat,,,False,,,,,No link found,No link found,No link found,https://reform.un.org/content/management-reform,https://open.un.org/un-secretariat-financials/expenses,Not found.,,
DOS,Department of Operational Support,Department of Operational Support (DOS),,"The DOS provides operational support to UN Secretariat entities, including advisory, operational and transactional support services and, where needed, exercises delegated authority on behalf of clients.",,https://operationalsupport.un.org/,https://en.wikipedia.org/wiki/Department_of_Operational_Support,Not found,,,,,,,,Secretariat,,,False,,,,https://operationalsupport.un.org/en/organizational-structure,No link found,https://operationalsupport.un.org/en/performance-overview,https://operationalsupport.un.org/strategic-foundations,https://operationalsupport.un.org/en/reports-and-resolutions,https://open.un.org/un-secretariat-financials/expenses,Not found.,https://x.com/UN_OpSupport,
DPO,Department of Peace Operations,Department of Peace Operations (DPO),,"DPO provides political and executive direction to UN peacekeeping operations around the world and maintains contact with the Security Council, troop and financial contributors, and parties to the conflict in the implementation of Security Council mandates.",,https://peacekeeping.un.org/en/department-of-peace-operations,https://en.wikipedia.org/wiki/United_Nations_Department_of_Peace_Operations,https://peacekeeping.un.org/en/news,,,,,True,,,Secretariat,,,False,,,,https://peacekeeping.un.org/en/department-of-peace-operations,No link found,No link found,No link found,https://peacekeeping.un.org/en/reports,https://open.un.org/un-secretariat-financials/expenses,https://www.linkedin.com/company/un-department-of-peace-operations/,https://x.com/UNPeacekeeping,
DPPA,Department of Political and Peacebuilding Affairs,Department of Political and Peacebuilding Affairs (DPPA),,DPPA monitors and assesses global political developments with an eye to detecting potential crises before they erupt and devising effective responses.,,https://dppa.un.org/,https://en.wikipedia.org/wiki/United_Nations_Department_of_Political_and_Peacebuilding_Affairs,https://dppa.un.org/en/news,,,,,,,,Secretariat,,,False,,,,,No link found,https://dppa.un.org/en/2023-2026-results-framework,https://dppa.un.org/en/dppa-strategic-plan-2023-2026-updated,https://dppa.un.org/en/reports-and-policy-documents,https://open.un.org/un-secretariat-financials/expenses,https://www.linkedin.com/company/un-dppa/,https://x.com/UNDPPA,
DSS,Department of Safety and Security,Department of Safety and Security (DSS),,"The UNDSS provides critical advice and rapid decision-making capacity on UNSMS policy and operational issues to UNSMS members, senior United Nations management and personnel.",,https://www.un.org/undss/,https://en.wikipedia.org/wiki/United_Nations_Department_of_Safety_and_Security,https://www.un.org/undss/news,,,,,,,,Secretariat,,,False,,,,https://www.un.org/safety-and-security/en/about-us/organisational-chart,No link found,No link found,No link found,No annual report,https://open.un.org/un-secretariat-financials/expenses,https://www.linkedin.com/company/united-nations-department-of-safety-and-security/,,
ECA,Economic Commission for Africa,Economic Commission for Africa (ECA),,"The ECA's mandate is to promote the economic and social development of its member States, foster intra-regional integration, and promote international cooperation for Africa's development.","- The secretariat of this entity is part of the United Nations Secretariat.
",https://www.uneca.org/,https://en.wikipedia.org/wiki/United_Nations_Economic_Commission_for_Africa,https://www.uneca.org/stories,,,,,True,,,Economic and Social Council,Regional Commissions,,False,,,,,,No link found,https://www.uneca.org/medium-term-programme-framework-%282022%E2%80%932025%29,"https://repository.uneca.org/search?spc.page=1&scope=&f.entityType=Publication,equals&f.flagshipPublication=Economic%20Report%20on%20Africa,equals&f.dateIssued.min=2025",Not found,https://www.linkedin.com/company/united-nations-economic-commission-for-africa/,https://x.com/ECA_OFFICIAL,
ECE,Economic Commission for Europe,Economic Commission for Europe (ECE),,"As a multilateral platform, UNECE facilitates greater economic integration and cooperation among its member countries and promotes sustainable development and economic prosperity.","- The secretariat of this entity is part of the United Nations Secretariat.
",https://unece.org/,https://en.wikipedia.org/wiki/United_Nations_Economic_Commission_for_Europe,https://unece.org/media/news,,,,,True,,,Economic and Social Council,Regional Commissions,,False,,,,,,https://unece.org/evaluation-policy-0,https://unece.org/environment-policy/public-participation/strategic-plan-2022-2030,https://unece.org/unece-content/publications?f%5B0%5D=subprogramme%3A446,Not found,https://www.linkedin.com/company/united-nations-economic-commission-for-europe/,,
ECLAC,Economic Commission for Latin America and the Caribbean,Economic Commission for Latin America and the Caribbean (ECLAC),,The ECLAC coordinates policies for the promotion of sustainable Latin American and Carriibean economic development and to foster regional and international trade.,"- The secretariat of this entity is part of the United Nations Secretariat.
",https://www.cepal.org/,https://en.wikipedia.org/wiki/Economic_Commission_for_Latin_America_and_the_Caribbean,https://www.cepal.org/en/news,,,,,True,,,Economic and Social Council,Regional Commissions,,False,"<https://www.cepal.org/en/about/mandate-and-mission>
",,,,,https://repositorio.cepal.org/server/api/core/bitstreams/ea965022-4466-4d5c-ae96-063cbcff30f0/content,https://caribbean.eclac.org/publications/strategic-plan-2015-2025?utm_source=chatgpt.com,https://www.cepal.org/en/publications,Not found,https://www.linkedin.com/company/eclac/,https://x.com/eclac_un,
EOSG,Executive Office of the Secretary-General,Executive Office of the Secretary-General (EOSG),,"The EOSG assists the Secretary-General with relations with members and organs of the United Nations and with specialized agencies and non-governmental organizations, as well as to assist with policy and coordination of the Secretariat.",,https://www.un.org/sg,https://en.wikipedia.org/wiki/Executive_Office_of_the_Secretary-General_of_the_United_Nations,Not found,,,,,,,,Secretariat,,,False,,,,,No link found,No link found,No link found,,https://open.un.org/un-secretariat-financials/expenses,Not found.,,
ESCAP,Economic and Social Commission for Asia and the Pacific,Economic and Social Commission for Asia and the Pacific (ESCAP),,The Economic and Social Commission for Asia and the Pacific serves as the United Nations’ regional hub promoting cooperation among countries to achieve inclusive and sustainable development. It is the largest regional intergovernmental platform with 53 Member States and 9 associate members.,"- The secretariat of this entity is part of the United Nations Secretariat.
",https://www.unescap.org/,https://en.wikipedia.org/wiki/United_Nations_Economic_and_Social_Commission_for_Asia_and_the_Pacific,https://www.unescap.org/news,,https://data.unescap.org/,,,True,,,Economic and Social Council,Regional Commissions,,False,,,,,,No link found,https://www.unescap.org/sites/default/d8files/event-documents/80_21_2400174_E_2.pdf,https://www.unescap.org/resources?f%5B0%5D=field_resource_type_new%3A9052,Not found,https://www.linkedin.com/company/unescap/,https://x.com/UNESCAP,
ESCWA,Economic and Social Commission for Western Asia,Economic and Social Commission for Western Asia (ESCWA),,"The purpose of ESCWA is to stimulate economic activity in member countries, strengthen cooperation between them and promote development.","- The secretariat of this entity is part of the United Nations Secretariat.
",https://www.unescwa.org/,https://en.wikipedia.org/wiki/United_Nations_Economic_and_Social_Commission_for_Western_Asia,https://www.unescwa.org/news,,,,,True,,,Economic and Social Council,Regional Commissions,,False,,,,,https://www.unescwa.org/about/services/budget,https://www.unescwa.org/about/strategy,https://www.unescwa.org/about/strategy,https://archive.unescwa.org/recurring-publication-identifier/escwa-annual-report,Not found,https://www.linkedin.com/company/unescwa,https://x.com/UNESCWA,
Ethics Office,United Nations Ethics Office,United Nations Ethics Office (Ethics Office),,"The UN Ethics Office promotes an ethical organizational culture based on UN’s core values of integrity, professionalism and respect for diversity, and the values outlined in Standards of Conduct for the International Civil Service, which include independence, loyalty, impartiality, integrity, accountability and respect for human rights. The Ethics Office assists the Secretary-General in ensuring that all staff members perform their functions consistent with the highest standards of integrity as required by the Charter of the United Nations. ",,https://www.un.org/en/ethics/,https://en.wikipedia.org/wiki/United_Nations_Ethics_Office,Not found,,,,,,,,Secretariat,,,False,,,,,https://www.un.org/en/ethics/overview/documents-resources.shtml,No link found,No link found,https://www.un.org/en/ethics/overview/documents-resources.shtml,Not found,Not found.,,
FAO,Food and Agriculture Organization,Food and Agriculture Organization (FAO),,The FAO aims to: raise levels of nutrition and standards of living secure improvements in food production and distribution better the conditions of rural people and contribute toward an expanding world economy and ensure freedom from hunger.,"- Member of the United Nations System Chief Executives Board for Coordination (CEB).
- This organization is separate and independent from the United Nations. It has been brought into relationship with the United Nations through a relationship agreement.
",https://www.fao.org/,https://en.wikipedia.org/wiki/Food_and_Agriculture_Organization,https://www.fao.org/news,,,,,True,,"Rome, Italy",Specialized Agencies,,,True,,,,https://www.fao.org/about/org-chart/en/,https://www.fao.org/about/strategy-programme-budget/fao-budget/,https://www.fao.org/about/strategy-programme-budget/overview/planning-monitoring-reporting/en,https://www.fao.org/about/strategy-programme-budget/overview/FAO-Strategic-Framework/en,https://openknowledge.fao.org/home,https://www.fao.org/transparency/en,https://www.linkedin.com/company/fao,https://x.com/FAO,
Fifth Committee,Administrative and Budgetary Committee,Administrative and Budgetary Committee (Fifth Committee),,,,https://www.un.org/en/ga/fifth/index.shtml,,,,,,,,,,General Assembly,Intergovernmental and Expert Bodies,Main Committees,,,,,,,,,,,,,
First Committee,Disarmament and International Security,Disarmament and International Security (First Committee),,,,https://www.un.org/en/ga/first/index.shtml,,,,,,,,,,General Assembly,Intergovernmental and Expert Bodies,Main Committees,,,,,,,,,,,,,
Fourth Committee,Special Political and Decolonization,Special Political and Decolonization (Fourth Committee),,,,https://www.un.org/en/ga/fourth/index.shtml,,,,,,,,,,General Assembly,Intergovernmental and Expert Bodies,Main Committees,,,,,,,,,,,,,
HLPF,High-level Political Forum on Sustainable Development,High-level Political Forum on Sustainable Development (HLPF),,,"- HLPF was established by the General Assembly. Meetings of HLPF are separately convened under the auspices of the General Assembly and of the Economic and Social Council.
",https://hlpf.un.org/,,,,,,,,,,"['General Assembly', 'Economic and Social Council']",,,,,,,,,,,,,,,
HRC,Human Rights Council,Human Rights Council (HRC),,,,https://www.ohchr.org/en/hrbodies/hrc/home,,,,,,,,,,General Assembly,Intergovernmental and Expert Bodies,Assemblies and Councils,,,,,,,,,,,,,
IAEA,International Atomic Energy Agency,International Atomic Energy Agency (IAEA),,"The IAEA is the world's centre for cooperation in the nuclear field, promoting the safe, secure and peaceful use of nuclear technology. It works in a wide range of areas including energy generation, health, food and agriculture and environmental protection.","- Member of the United Nations System Chief Executives Board for Coordination (CEB).
- This organization is separate and independent from the United Nations. It has been brought into relationship with the United Nations through a relationship agreement.
",https://www.iaea.org/,https://en.wikipedia.org/wiki/International_Atomic_Energy_Agency,https://www.iaea.org/news,,,,,,,"Vienna, Austria",Related Organizations,,,True,,,,,https://www.iaea.org/about/overview/budget,No link found,https://www.iaea.org/about/overview/medium-term-strategy,https://www.iaea.org/Publications/Reports,Not found,https://www.linkedin.com/company/iaea,https://x.com/iaeaorg,
ICAO,International Civil Aviation Organization,International Civil Aviation Organization (ICAO),,The International Civil Aviation Organization (ICAO) is a United Nations agency which helps 193 countries to cooperate together and share their skies to their mutual benefit.,"- Member of the United Nations System Chief Executives Board for Coordination (CEB).
- This organization is separate and independent from the United Nations. It has been brought into relationship with the United Nations through a relationship agreement.
",https://www.icao.int/,https://en.wikipedia.org/wiki/International_Civil_Aviation_Organization,https://www.icao.int/Newsroom,,,,,True,,"Montreal, Canada",Specialized Agencies,,,True,,,,https://www.icao.int/sites/default/files/Meetings/a42/Documents/WP/wp_037_en.pdf,No link found,No link found,https://www2023.icao.int/about-icao/Council/Pages/strategic-plan-2026-2050.aspx,https://www2023.icao.int/about-icao/Pages/annual-reports.aspx,Not found,https://www.linkedin.com/company/international-civil-aviation-organization/,,
ICC,International Criminal Court,International Criminal Court (ICC),,"The International Criminal Court (ICC) investigates and, where warranted, tries individuals charged with the gravest crimes of concern to the international community: genocide, war crimes, crimes against humanity and the crime of aggression.","- This organization is separate and independent from the United Nations. It has been brought into relationship with the United Nations through a relationship agreement.
",https://www.icc-cpi.int/,https://en.wikipedia.org/wiki/International_Criminal_Court,https://www.icc-cpi.int/news,,,,,,,"The Hague, Netherlands",Related Organizations,,,False,,,,,https://asp.icc-cpi.int/bureau/WorkingGroups/budget,No link found,https://www.icc-cpi.int/sites/default/files/2023-08/2023-strategic-plan-icc-v.2.pdf,https://www.icc-cpi.int/resource-library/reports,Not found,https://www.linkedin.com/company/international-criminal-court,https://x.com/IntlCrimCourt,
ICJ,International Court of Justice,International Court of Justice (ICJ),,The Court’s role is to settle legal disputes submitted to it by States and to give advisory opinions on legal questions referred to it by authorized United Nations organs and specialized agencies.,,https://www.icj-cij.org/,https://en.wikipedia.org/wiki/International_Court_of_Justice,https://www.icj-cij.org/news,,,,,,,,International Court of Justice,International Court of Justice,,False,,,,,,No link found,No link found,https://www.icj-cij.org/en/publications,Not found,https://www.linkedin.com/company/cour-internationale-de-justice-international-court-of-justice/,,
ICSC,International Civil Service Commission,International Civil Service Commission (ICSC),,"The ICSC's focus is to strengthen and maintain high standards in the international civil service, while balancing the needs and concerns of its major stakeholders.",,https://icsc.un.org/,https://en.wikipedia.org/wiki/International_Civil_Service_Commission,https://icsc.un.org/News,,,,,,,,General Assembly,Intergovernmental and Expert Bodies,Commissions,False,,,,,,No link found,No link found,https://icsc.un.org/Home/Library,Not found,https://www.linkedin.com/company/international-civil-service-commission,,
