entity,entity_long,entity_combined,entity_aliases,entity_description,entity_footnotes,entity_link,entity_wikipedia_page,entity_news_page,entity_branding_page,entity_data_page,entity_logo_page,entity_logo_url,entity_logo_available,entity_careers_page,entity_headquarters,un_principal_organ,category,subcategory,is_ceb_member,foundational_mandate,entity_mandate_registry,entity_custom_mandate_registry,organizational_chart_link,budget_financial_reporting_link,results_framework_link,strategic_plan_link,annual_reports_link,transparency_portal_link,socials_linkedin,socials_twitter,socials_instagram
IFAD,International Fund for Agricultural Development,International Fund for Agricultural Development (IFAD),,The IFAD is an international financial institution and UN specialised agency dedicated to eradicating poverty in rural areas of developing countries.,"- Member of the United Nations System Chief Executives Board for Coordination (CEB).
- This organization is separate and independent from the United Nations. It has been brought into relationship with the United Nations through a relationship agreement.
",https://www.ifad.org/,https://en.wikipedia.org/wiki/International_Fund_for_Agricultural_Development,https://www.ifad.org/en/news-and-events,,,,,,,"Rome, Italy",Specialized Agencies,,,True,,,,https://www.ifad.org/documents/d/new-ifad.org/ifad-organigram,"no budget, but annual financial statements (https://www.ifad.org/en/financial-documents)",https://www.ifad.org/en/results-management-framework,https://www.ifad.org/en/w/corporate-documents/policies/ifad-strategic-framework-2016-20251,https://www.ifad.org/pub/annual_report/list,https://www.ifad.org/en/operations-dashboard,https://www.linkedin.com/company/international-fund-for-agricultural-development/,,
IIIM,"International, Impartial and Independent Mechanism to Assist in the Investigation and Prosecution of Persons Responsible for the Most Serious Crimes under International Law Committed in the Syrian Arab Republic since March 2011","International, Impartial and Independent Mechanism to Assist in the Investigation and Prosecution of Persons Responsible for the Most Serious Crimes under International Law Committed in the Syrian Arab Republic since March 2011 (IIIM)",,"The Mechanism’s mandate, is “to collect, consolidate, preserve and analyse evidence of violations of international humanitarian law and human rights violations and abuses.",,https://iiim.un.org/,"https://en.wikipedia.org/wiki/International,_Impartial_and_Independent_Mechanism",https://iiim.un.org/news,,,,,,,,General Assembly,Other Mechanisms,,False,,,,,No link found,No link found,No link found,https://iiim.un.org/documents/reports-to-general-assembly/,https://open.un.org/un-secretariat-financials/expenses,https://www.linkedin.com/company/international-impartial-and-independent-mechanism-syria,,
IIMM,Independent Investigative Mechanism for Myanmar,Independent Investigative Mechanism for Myanmar (IIMM),,,,https://iimm.un.org/,https://en.wikipedia.org/wiki/Independent_Investigative_Mechanism_for_Myanmar,https://iimm.un.org/news/,,,,,,,,General Assembly,Other Mechanisms,,False,,,,,No link found,No link found,https://iimm.un.org/strategic-plan,https://iimm.un.org/en/annual-reports,https://open.un.org/un-secretariat-financials/expenses,Not found.,,
IIMP,Independent Institution on Missing Persons in the Syrian Arab Republic,Independent Institution on Missing Persons in the Syrian Arab Republic (IIMP),,,,https://iimp.un.org/,,,,,,,,,,General Assembly,Other Mechanisms,,False,,,,,,,,,,,,
ILC,International Law Commission,International Law Commission (ILC),,,,https://legal.un.org/ilc/ilcintro.shtml,,,,,,,,,,General Assembly,Intergovernmental and Expert Bodies,Commissions,,,,,,,,,,,,,
ILO,International Labor Organization,International Labor Organization (ILO),,"The ILO was founded in 1919, its Constitution forming part of the Treaty of Versailles. The ILO became the first specialised agency of the UN in 1946.","- Member of the United Nations System Chief Executives Board for Coordination (CEB).
- This organization is separate and independent from the United Nations. It has been brought into relationship with the United Nations through a relationship agreement.

",https://www.ilo.org/,https://en.wikipedia.org/wiki/International_Labour_Organization,https://www.ilo.org/global/about-the-ilo/newsroom/news/lang--en/index.htm,,,,,,,"Geneva, Switzerland",Specialized Agencies,,,True,,,,https://www.ilo.org/sites/default/files/2025-01/ILO_organizational%20chart_Jan-2025-EN.pdf,https://www.ilo.org/about-ilo/how-ilo-works/organizational-structure-international-labour-office/financial-management/programme-and-budget,https://www.ilo.org/about-ilo/how-ilo-works/results-based-management/evaluation-ilos-results-based-management-framework,https://www.ilo.org/resource/conference-paper/gb/352/ilo%E2%80%99s-strategic-plan-2026%E2%80%9329,https://www.ilo.org/publications/annual-report-2024,Not found,https://www.linkedin.com/company/international-labour-organization/,https://x.com/ilo,
IMF,International Monetary Fund,International Monetary Fund (IMF),,,"- Member of the United Nations System Chief Executives Board for Coordination (CEB).
- This organization is separate and independent from the United Nations. It has been brought into relationship with the United Nations through a relationship agreement.
",https://www.imf.org/,https://en.wikipedia.org/wiki/International_Monetary_Fund,https://www.imf.org/en/News,,,,,,,"Washington, DC, USA",Specialized Agencies,,,True,,,,https://www.imf.org/en/About/Organization-Chart,No link found,No link found,https://www.imf.org/en/Capacity-Development/strategy-policies,https://www.imf.org/en/publications/search#sort=relevancy,Not found,https://www.linkedin.com/company/international-monetary-fund/,https://x.com/IMFNews,
IMO,International Maritime Organization,International Maritime Organization (IMO),,"The IMO is responsible for the safety of life at sea, maritime security and the protection of the marine environment through prevention of sea pollution caused by ships.","- Member of the United Nations System Chief Executives Board for Coordination (CEB).
- This organization is separate and independent from the United Nations. It has been brought into relationship with the United Nations through a relationship agreement.
",https://www.imo.org/,https://en.wikipedia.org/wiki/International_Maritime_Organization,https://www.imo.org/en/MediaCentre/Pages/Default.aspx,,,,,,,,Specialized Agencies,,,True,,,,,https://www.imo.org/en/about/pages/structure.aspx,No link found,https://www.imo.org/en/about/strategy/pages/default.aspx,https://www.imo.org/en/OurWork/TechnicalCooperation/Pages/Default.aspx,Not found,https://www.linkedin.com/company/international-maritime-organization/,https://x.com/IMOHQ,
IOM,International Organization for Migration,International Organization for Migration (IOM),,The IOM is the leading intergovernmental organization in the field of migration and is committed to the principle that humane and orderly migration benefits migrants and society.,"- Member of the United Nations System Chief Executives Board for Coordination (CEB).
- This organization is separate and independent from the United Nations. It has been brought into relationship with the United Nations through a relationship agreement.
",https://www.iom.int/,https://en.wikipedia.org/wiki/International_Organization_for_Migration,https://www.iom.int/news,,,,,,,"Geneva, Switzerland",Related Organizations,,,True,,,,,https://governingbodies.iom.int/financial-reports,https://www.iom.int/iom-strategic-results-framework-srf,https://www.iom.int/iom-strategic-plan-2024-2028,https://governingbodies.iom.int/,Not found,https://www.linkedin.com/company/international-organization-for-migration-iom/,https://x.com/UNmigration,
ISA,International Seabed Authority,International Seabed Authority (ISA),,"The ISA is mandated under the UN Convention on the Law of the Sea to organize, regulate and control all mineral-related activities in the international seabed area for the benefit of mankind as a whole.","- This organization is separate and independent from the United Nations. It has been brought into relationship with the United Nations through a relationship agreement.
",https://www.isa.org.jm/,https://en.wikipedia.org/wiki/International_Seabed_Authority,https://www.isa.org.jm/news,,,,,,,,Related Organizations,,,False,,,,,,No link,https://www.isa.org.jm/strategic-plan/,https://www.isa.org.jm/publications,Not found,https://www.linkedin.com/company/international-seabed-authority/,,
ITC,International Trade Centre,International Trade Centre (ITC),,The International Trade Centre (ITC) works towards global prosperity by connecting small businesses in developing countries to international markets.,,https://intracen.org/,https://en.wikipedia.org/wiki/International_Trade_Centre,https://intracen.org/news,,,,,,,"Geneva, Switzerland",General Assembly,Other Entities,,False,,,,,https://www.intracen.org/about-us/governance#scroll-to-section-budget,No link found,https://www.intracen.org/about-us/governance/corporate-documents/itc-strategic-plan,https://intracen.org/about-us/governance/corporate-documents/itc-annual-report,https://open.intracen.org/,https://www.linkedin.com/company/international-trade-centre/,https://x.com/ITCnews,
ITLOS,International Tribunal for the Law of the Sea,International Tribunal for the Law of the Sea (ITLOS),,"The ITLOS is an independent judicial body established by the United Nations Convention on the Law of the Sea to adjudicate disputes regarding all ocean space, its uses and resources.","- This organization is separate and independent from the United Nations. It has been brought into relationship with the United Nations through a relationship agreement.
",https://www.itlos.org/,https://en.wikipedia.org/wiki/International_Tribunal_for_the_Law_of_the_Sea,https://www.itlos.org/news/,,,,,,,,Related Organizations,,,False,,,,,https://www.itlos.org/en/main/general-information/finances/,No link found,No link found,https://www.itlos.org/en/main/the-tribunal/annual-reports/,Not found,Not found.,https://x.com/ITLOS_TIDM,
ITU,International Telecommunication Union,International Telecommunication Union (ITU),,The ITU is an inter-governmental organization that brings together governments and industry to coordinate the establishment and operation of global telecommunication networks and services.,"- Member of the United Nations System Chief Executives Board for Coordination (CEB).
- This organization is separate and independent from the United Nations. It has been brought into relationship with the United Nations through a relationship agreement.
",https://www.itu.int/,https://en.wikipedia.org/wiki/International_Telecommunication_Union,https://www.itu.int/en/ITU-D/Pages/News.aspx,,,,,,,"Geneva, Switzerland",Specialized Agencies,,,True,,,,https://digitallibrary.un.org/record/829886?ln=en&v=pdf,https://www.itu.int/en/mediacentre/backgrounders/Pages/how-is-itu-funded.aspx,No link found,https://www.itu.int/en/council/planning/Pages/default.aspx,https://www.itu.int/pub/S-CONF-AREP-2009/en,Not found,https://www.linkedin.com/company/international-telecommunication-union/,https://x.com/ITU,
JIU,Joint Inspection Unit,Joint Inspection Unit (JIU),,"The JIU is the only independent external oversight body of the United Nations system mandated to conduct evaluations, inspections and investigations system-wide.",,https://www.unjiu.org/,https://en.wikipedia.org/wiki/Joint_Inspection_Unit,https://www.unjiu.org/news,,,,,,,,General Assembly,Intergovernmental and Expert Bodies,Standing Committees and other bodies,False,,,,,https://www.unjiu.org/content/funding-and-budget,No link found,https://www.unjiu.org/content/strategic-framework,https://www.unjiu.org/content/reports,Not found,https://www.linkedin.com/company/un-joint-inspection-unit,,
MINURSO,United Nations Mission for the Referendum in Western Sahara,United Nations Mission for the Referendum in Western Sahara (MINURSO),,MINURSO is mandated in accordance with the settlement plan which provides for a transitional period for the preparation of a referendum in which the people of Western Sahara would choose between independence and integration with Morocco.,,https://minurso.unmissions.org/,https://en.wikipedia.org/wiki/United_Nations_Mission_for_the_Referendum_in_Western_Sahara,https://minurso.unmissions.org/news,,,,,,,,Security Council,Peacekeeping Operations,,False,"<https://minurso.unmissions.org/mandate>
",,,,,No link found,No link found,https://minurso.unmissions.org/secretary-general-reports,Not found,Not found.,,
MINUSCA,United Nations Multidimensional Integrated Stabilization Mission in the Central African Republic,United Nations Multidimensional Integrated Stabilization Mission in the Central African Republic (MINUSCA),,"MINUSCA is a UN peacekeeping mission, which started on April 10, 2014, to protect Central African Republic civilians under Chapter VII of the UN Charter.",,https://minusca.unmissions.org/,https://en.wikipedia.org/wiki/United_Nations_Multidimensional_Integrated_Stabilization_Mission_in_the_Central_African_Republic,https://minusca.unmissions.org/en/news,,,,,,,,Security Council,Peacekeeping Operations,,False,"<https://minusca.unmissions.org/en/mandate>
",,,,,No link found,No link found,https://minusca.unmissions.org/en/reports-secretary-general,Not found,Not found.,,
MONUSCO,United Nations Organization Stabilization Mission in the Democratic Republic of the Congo,United Nations Organization Stabilization Mission in the Democratic Republic of the Congo (MONUSCO),,"MONUSCO's mandate relates to, among other things, to the protection of civilians, humanitarian personnel and human rights defenders under imminent threat of physical violence and to support the Government of the DRC in its stabilization and peace consolidation efforts.",,https://monusco.unmissions.org/,https://en.wikipedia.org/wiki/United_Nations_Organization_Stabilization_Mission_in_the_Democratic_Republic_of_the_Congo,https://monusco.unmissions.org/en/news,,,,,,,,Security Council,Peacekeeping Operations,,False,,,,,,No link found,No link found,https://monusco.unmissions.org/en/reports-secretary-general-0,Not found,https://www.linkedin.com/company/united-nations-organization-stabilization-mission-in-the-democratic-republic-of-the-congo,,
MSC,Military Staff Committee,Military Staff Committee (MSC),,,,https://main.un.org/securitycouncil/en/subsidiary/msc,,,,,,,,,,Security Council,Committees,,,,,,,,,,,,,,
NGO Committee,Committee on Non-Governmental Organizations,Committee on Non-Governmental Organizations (NGO Committee),,,,https://ecosoc.un.org/en/ngo/committee-on-ngos,,,,,,,,,,Economic and Social Council,Other Bodies,,,,,,,,,,,,,,
OAJ,Office of Administration of Justice,Office of Administration of Justice (OAJ),,,,https://www.un.org/en/internaljustice/oaj/,https://en.wikipedia.org/wiki/United_Nations_Office_of_Administration_of_Justice,https://www.un.org/en/internaljustice/oaj/news.shtml,,,,,,,,Secretariat,,,False,,,,https://www.un.org/en/internaljustice/oaj/organizational-structure.shtml,No link found,No link found,No link found,https://www.un.org/en/internaljustice/oaj/activity-reports.shtml,Not found,Not found.,,
OCHA,Office for the Coordination of Humanitarian Affairs,Office for the Coordination of Humanitarian Affairs (OCHA),,"With its partners, OCHA contributes to principled and effective humanitarian response through coordination, advocacy, policy, information management and humanitarian financing tools and services.",,https://www.unocha.org/,https://en.wikipedia.org/wiki/United_Nations_Office_for_the_Coordination_of_Humanitarian_Affairs,https://www.unocha.org/news,https://brand.unocha.org/,,https://brand.unocha.org/d/xEPytAUjC3sH/visual-identity#/ocha-logo/ocha-logo,,True,,,Secretariat,,,False,,,,,https://www.unocha.org/our-funding,https://www.unocha.org/publications,https://www.unocha.org/publications/report/world/ochas-strategic-plan-2023-2026-transforming-humanitarian-coordination,https://www.unocha.org/about-us/publications/core-publications,https://fts.unocha.org/,https://www.linkedin.com/company/un-ocha/,https://x.com/UNOCHA,
OCT,Office of Counter-Terrorism,Office of Counter-Terrorism (OCT),,"The UNOCT works closely with UN Member States, UN entities, civil society, and other related stakeholders, strengthening existing and developing new partnerships to effectively prevent and counter terrorism.",,https://www.un.org/counterterrorism/,https://en.wikipedia.org/wiki/United_Nations_Office_of_Counter-Terrorism,https://www.un.org/counterterrorism/news,,,,,,,,Secretariat,,,False,,,,https://www.un.org/counterterrorism/office-structure,https://www.un.org/counterterrorism/funding-and-donors,No link found,https://www.un.org/counterterrorism/sites/www.un.org.counterterrorism/files/unoct_strategic_plan_results_framework_2022-25.pdf,https://www.un.org/counterterrorism/un-documents,Not found,https://www.linkedin.com/company/un-office-of-counter-terrorism/,https://x.com/UN_OCT,
ODA,Office for Disarmament Affairs,Office for Disarmament Affairs (ODA),,The ODA supports multilateral efforts aimed at achieving the ultimate goal of general and complete disarmament under strict and effective international control.,,https://www.un.org/disarmament/,https://en.wikipedia.org/wiki/United_Nations_Office_for_Disarmament_Affairs,https://www.un.org/disarmament/news/,,,,,True,,,Secretariat,,,False,,,,,https://disarmament.unoda.org/en/our-work/cross-cutting-issues/financial-matters,No link found,https://disarmament.unoda.org/unoda-strategic-plan-2021-2025/,https://www.un.org/disarmament/publications/yearbook/,Not found,https://www.linkedin.com/company/united-nations-office-for-disarmament-affairs/,https://x.com/UN_Disarmament,
ODET,Office for Digital and Emerging Technologies,Office for Digital and Emerging Technologies (ODET),,,,https://www.un.org/digital-emerging-technologies/,Not found,Not found,,,,,,,,Secretariat,,,False,,,,,,No link found,No link found,https://www.un.org/digital-emerging-technologies/content/news,Not found,Not found.,https://x.com/ODET_UN,
ODPP,Office of Data Protection and Privacy,Office of Data Protection and Privacy (ODPP),,,,https://policy.un.org/en/information-and-technology/data-protection,Not found.,Not found,,,,,,,,Secretariat,,,False,,,,,,No link found,No link found,https://policy.un.org/en/information-and-technology/data-protection,Not found,Not found.,,
OHCHR,Office of the United Nations High Commissioner for Human Rights,Office of the United Nations High Commissioner for Human Rights (OHCHR),,"The ONHCR promotes and protects the effective enjoyment by all people of all civil, cultural, economic, political and social rights, including the right to development.",,https://www.ohchr.org/,https://en.wikipedia.org/wiki/Office_of_the_United_Nations_High_Commissioner_for_Human_Rights,https://www.ohchr.org/en/press-releases,,,,,True,,,Secretariat,,,False,,,https://hrcmap.ohchr.org/,,https://www.ohchr.org/about-us/funding-and-budget,https://www.ohchr.org/en/about-us/evaluation-un-human-rights,https://www.ohchr.org/en/publications/management-plan/un-human-rights-management-plan-2022-2023,https://www.ohchr.org/en/publications?field_content_category_target_id[177]=177,Not found,https://www.linkedin.com/company/office-of-the-united-nations-high-commissioner-for-human-rights-ohchr/,https://x.com/UNHumanRights,
OICT,Office of Information and Communications Technology,Office of Information and Communications Technology (OICT),,"The OICT defines the strategic direction for ICT to the Secretariat. It provides oversight of ICT programmes, budgets and decision-making to ensure alignment with the Secretariat’s overall ICT strategy.",,https://unite.un.org/,https://en.wikipedia.org/wiki/Office_of_Information_and_Communications_Technology,Not found,,,,,,,,Secretariat,,,False,,,,,,No link found,No link found,https://www.un.org/annualreport/,Not found,https://www.linkedin.com/company/un-oict,https://x.com/UN_OICT,
OIOS,Office of Internal Oversight Services,Office of Internal Oversight Services (OIOS),,"The OIOS assists the Secretary-General in fulfilling his oversight responsibilities in respect of the resources and staff of the Organization through the provision of audit, investigation, inspection and evaluation services.",,https://oios.un.org/,https://en.wikipedia.org/wiki/Office_of_Internal_Oversight_Services,Not found,,,,,,,,Secretariat,,,False,,,,,,No link found,No link found,https://oios.un.org/annual-reports,Not found,https://www.linkedin.com/company/office-of-internal-oversight-services-oios,,
OLA,Office of Legal Affairs,Office of Legal Affairs (OLA),,OLA provides a unified central legal service for the Secretariat and other entities of the United Nations and contributes to the progressive development and codification of international public and trade law.,,https://legal.un.org/ola/,https://en.wikipedia.org/wiki/United_Nations_Office_of_Legal_Affairs,Not found,,,,,True,,,Secretariat,,,False,,,,https://legal.un.org/ola/media/OLA_chart.pdf,,No link found,No link found,https://legal.un.org/ola/publications.aspx,Not found,https://www.linkedin.com/company/un-office-of-legal-affairs,,
OOSA,Office for Outer Space Affairs,Office for Outer Space Affairs (OOSA),,UNOOSA is responsible for promoting international cooperation in the peaceful uses of outer space. It serves as the secretariat for the General Assembly's only committee dealing exclusively with international cooperation in the peaceful uses of outer space.,,https://www.unoosa.org/,https://en.wikipedia.org/wiki/United_Nations_Office_for_Outer_Space_Affairs,https://www.unoosa.org/oosa/en/informationfor/media/index.html,,,,,,,,Secretariat,,,False,,,,,,No link found,https://www.unoosa.org/res/oosadoc/data/documents/2024/stspace/stspace88_0_html/st_space-088E.pdf,https://www.unoosa.org/oosa/en/aboutus/annual-reports.html,Not found,https://www.linkedin.com/company/united-nations-office-for-outer-space-affairs/,,
OPCW,Organisation for the Prohibition of Chemical Weapons,Organisation for the Prohibition of Chemical Weapons (OPCW),,"As the implementing body for the Chemical Weapons Convention, the OPCW, with its 193 Member States, oversees the global endeavour to permanently and verifiably eliminate chemical weapons.","- This organization is separate and independent from the United Nations. It has been brought into relationship with the United Nations through a relationship agreement.
",https://www.opcw.org/,https://en.wikipedia.org/wiki/Organisation_for_the_Prohibition_of_Chemical_Weapons,https://www.opcw.org/media-centre/news,,,,,,,"The Hague, Netherlands",Related Organizations,,,False,,,,,,No link found,https://www.opcw.org/sites/default/files/documents/2023/08/EC-104_S-1_C-28_S-1_EN.pdf,https://www.opcw.org/resources/documents/annual-reports,Not found,https://www.linkedin.com/company/opcw/,,
OSAA,Office of the Special Adviser on Africa,Office of the Special Adviser on Africa (OSAA),,"The OSAA strives for coordinated, effective and sustained UN and international support for Africa’s transformative efforts for inclusive sustainable peace, security, socioeconomic development and justice for all.",,https://www.un.org/osaa/,https://en.wikipedia.org/wiki/Office_of_the_Special_Adviser_on_Africa,https://www.un.org/osaa/news,,,,,,,,Secretariat,"Special Advisers, Representatives, Advocates and Envoys",,False,,,,,,No link found,https://www.un.org/osaa/content/osaa-strategic-agenda,https://www.un.org/osaa/content/reports-and-publications,Not found,https://www.linkedin.com/company/un-office-of-the-special-adviser-on-africa-osaa/,,
OSACAJT,Office of the Special Adviser on Climate Action and Just Transition,Office of the Special Adviser on Climate Action and Just Transition (OSACAJT),,,,https://www.un.org/sg/en/global-leadership/entity/secretariat-and-regional-commissions/office-of-the-special-adviser-climate-action-and-just-transition,,,,,,,,,,Secretariat,"Special Advisers, Representatives, Advocates and Envoys",,False,,,,,,,,,Not found,,,
OSASG-Cyprus,Office of the Special Adviser to the Secretary-General on Cyprus,Office of the Special Adviser to the Secretary-General on Cyprus (OSASG-Cyprus),,The United Nations works through the good offices of the Secretary-General to assist the sides in the search for a comprehensive and mutually acceptable settlement to the Cyprus problem. The Department of Political and Peacebuilding Affairs (DPPA) provides backstopping support and guidance to the Office of the Special Adviser to the Secretary-General on Cyprus. While the good,,https://dppa.un.org/en/mission/special-adviser-cyprus,https://en.wikipedia.org/wiki/Office_of_the_Special_Adviser_to_the_Secretary-General_on_Cyprus,Not found,,,,,,,,Security Council,Special Political Missions and Other Political Presences,,False,"<https://uncyprustalks.unmissions.org/en/osasg-cyprus-mandate>

The mandate of the Office of the Special Adviser to the Secretary-General on Cyprus (OSASG-Cyprus) derives from the priorities established in relevant Security Council resolutions, beginning with resolution 186 (1964), and related decisions and an exchange of letters between the Secretary-General and the President of the Security Council (S/2008/456 and S/2008/457).
",,,,,No link found,No link found,No annual report,Not found,Not found.,,
